{
  "$schema": "https://json-schema.org/draft/2020-12/schema",
  "$id": "https://faultline.invalid/contracts/report.schema.json",
  "title": "Faultline report",
  "type": "object",
  "additionalProperties": false,
  "properties": {
    "schema_version": {
      "const": 1
    },
    "id": {
      "type": "string",
      "pattern": "^[A-Za-z0-9][A-Za-z0-9:_-]{0,127}$"
    },
    "workspace_id": {
      "type": "string",
      "pattern": "^[A-Za-z0-9][A-Za-z0-9:_-]{0,127}$"
    },
    "case_id": {
      "type": "string",
      "pattern": "^[A-Za-z0-9][A-Za-z0-9:_-]{0,127}$"
    },
    "revision_id": {
      "type": "string",
      "pattern": "^[A-Za-z0-9][A-Za-z0-9:_-]{0,127}$"
    },
    "status": {
      "type": "string",
      "enum": [
        "draft",
        "published",
        "superseded",
        "withdrawn"
      ]
    },
    "title": {
      "type": "string",
      "minLength": 1,
      "maxLength": 200
    },
    "created_at": {
      "type": "string",
      "format": "date-time",
      "pattern": "^\\d{4}-\\d{2}-\\d{2}T\\d{2}:\\d{2}:\\d{2}\\.\\d{3}Z$"
    },
    "metric_hash": {
      "type": "string",
      "pattern": "^[a-f0-9]{64}$"
    },
    "snapshot_hash": {
      "type": "string",
      "pattern": "^[a-f0-9]{64}$"
    },
    "claim": {
      "$ref": "claim.schema.json"
    },
    "findings": {
      "type": "array",
      "items": {
        "type": "object",
        "additionalProperties": false,
        "properties": {
          "text": {
            "type": "string",
            "minLength": 1,
            "maxLength": 2000
          },
          "evidence_ids": {
            "type": "array",
            "items": {
              "type": "string",
              "pattern": "^[A-Za-z0-9][A-Za-z0-9:_-]{0,127}$"
            },
            "minItems": 1,
            "maxItems": 30
          },
          "test_result_ids": {
            "type": "array",
            "items": {
              "type": "string",
              "pattern": "^[A-Za-z0-9][A-Za-z0-9:_-]{0,127}$"
            },
            "minItems": 0,
            "maxItems": 20
          }
        },
        "required": [
          "text",
          "evidence_ids",
          "test_result_ids"
        ]
      },
      "minItems": 0,
      "maxItems": 30
    },
    "alternatives": {
      "type": "array",
      "items": {
        "type": "string",
        "minLength": 1,
        "maxLength": 2000
      },
      "minItems": 0,
      "maxItems": 10
    },
    "limitations": {
      "type": "array",
      "items": {
        "type": "string",
        "minLength": 1,
        "maxLength": 2000
      },
      "minItems": 1,
      "maxItems": 30
    },
    "recommended_actions": {
      "type": "array",
      "items": {
        "type": "string",
        "minLength": 1,
        "maxLength": 2000
      },
      "minItems": 0,
      "maxItems": 20
    },
    "follow_up": {
      "anyOf": [
        {
          "type": "object",
          "additionalProperties": false,
          "properties": {
            "due_at": {
              "anyOf": [
                {
                  "type": "string",
                  "format": "date-time",
                  "pattern": "^\\d{4}-\\d{2}-\\d{2}T\\d{2}:\\d{2}:\\d{2}\\.\\d{3}Z$"
                },
                {
                  "type": "null"
                }
              ]
            },
            "metric_hash": {
              "type": "string",
              "pattern": "^[a-f0-9]{64}$"
            },
            "required_source_intervals": {
              "type": "array",
              "items": {
                "type": "object",
                "additionalProperties": false,
                "properties": {
                  "start": {
                    "type": "string",
                    "format": "date-time",
                    "pattern": "^\\d{4}-\\d{2}-\\d{2}T\\d{2}:\\d{2}:\\d{2}\\.\\d{3}Z$"
                  },
                  "end": {
                    "type": "string",
                    "format": "date-time",
                    "pattern": "^\\d{4}-\\d{2}-\\d{2}T\\d{2}:\\d{2}:\\d{2}\\.\\d{3}Z$"
                  }
                },
                "required": [
                  "start",
                  "end"
                ]
              },
              "minItems": 1,
              "maxItems": 20
            },
            "mode": {
              "const": "observational"
            },
            "trigger_mode": {
              "enum": [
                "manual",
                "due_check"
              ]
            }
          },
          "required": [
            "due_at",
            "metric_hash",
            "required_source_intervals",
            "mode",
            "trigger_mode"
          ]
        },
        {
          "type": "null"
        }
      ]
    },
    "artifact_files": {
      "type": "array",
      "items": {
        "type": "object",
        "additionalProperties": false,
        "properties": {
          "path": {
            "type": "string",
            "maxLength": 240,
            "pattern": "^(?!/)(?!.*(?:^|/)\\.\\.(?:/|$))[A-Za-z0-9._/-]+$"
          },
          "sha256": {
            "type": "string",
            "pattern": "^[a-f0-9]{64}$"
          },
          "size_bytes": {
            "type": "integer",
            "minimum": 0,
            "maximum": 9007199254740991
          },
          "media_type": {
            "type": "string",
            "minLength": 1,
            "maxLength": 128
          }
        },
        "required": [
          "path",
          "sha256",
          "size_bytes",
          "media_type"
        ]
      },
      "minItems": 0,
      "maxItems": 100
    },
    "input_manifest_hash": {
      "type": "string",
      "pattern": "^[a-f0-9]{64}$"
    }
  },
  "required": [
    "schema_version",
    "id",
    "workspace_id",
    "case_id",
    "revision_id",
    "status",
    "title",
    "created_at",
    "metric_hash",
    "snapshot_hash",
    "claim",
    "findings",
    "alternatives",
    "limitations",
    "recommended_actions",
    "follow_up",
    "artifact_files",
    "input_manifest_hash"
  ]
}
