{
  "schema_version": 1,
  "id": "report-fixture",
  "workspace_id": "workspace-fixture",
  "case_id": "case-fixture",
  "revision_id": "revision-1",
  "status": "draft",
  "title": "Synthetic checkout investigation",
  "created_at": "2026-10-09T12:00:00.000Z",
  "metric_hash": "25e88e0d2448f070ea12b1afb686989a5f00133ff2fdcbe65f838492bcc508ca",
  "snapshot_hash": "b7b74494ec2dce465235f90dee685bc18212591b2fb13e521722d2435f927d35",
  "claim": {
    "association": "observed",
    "mechanism": "reproduced",
    "correction": "validated",
    "attribution": {
      "scope": "association_only",
      "causal_effect": "not_established"
    },
    "freshness": "fresh",
    "coverage_quality": "complete_attested",
    "scope": "synthetic_fixture",
    "warning": null
  },
  "findings": [
    {
      "text": "The controlled fixture reproduces the mobile failure.",
      "evidence_ids": [
        "evidence-1"
      ],
      "test_result_ids": [
        "reference-result-1"
      ]
    }
  ],
  "alternatives": [
    "Traffic mix alone does not explain the stable-mix regression fixture."
  ],
  "limitations": [
    "Reference-domain simulation only. No Faultline application or external browser was executed.",
    "No population causal effect is established."
  ],
  "recommended_actions": [
    "Run the actual app and isolated staging policy."
  ],
  "follow_up": null,
  "artifact_files": [],
  "input_manifest_hash": "a8198524f58e72b56283ab71ebddada22840f108b46ef7165bb3fca9919c5558"
}
